City,Place,Ratings,Distance,Place_desc
Mumbai, 1. Elephanta Caves ,4.3, 14 km  from city center ," An UNESCO World Heritage Site, Elephanta Caves is a specimen of rock cut art and architecture from the times of medieval India. It is an island and is located at a distance of 11km from the city of Mumbai. It also provides an amazing view of the Mumbai skyline.  "
Mumbai, 2. Walk at Marine drive ,4.5, 16 km  from city center ," Starting from the north of Nariman Point and ending at the famous Chowpatty beach, the Marine Drive is a 3km long arc shaped road along the sea coast of South Mumbai. The coast lines the Arabian sea and is the best place to watch the sunset in Mumbai.  "
Mumbai, 3. Picnic at Juhu Beach ,4.4, 8 km  from city center ," The most popular beach in Mumbai, Juhu beach is located close to Andheri and was once quite a beautiful beach. However, with so many tourists coming in here, the place has become dirty and water is also not clean because of affluents from nearby factories and industries. "
Mumbai, 4. Shopping at Colaba Causeway ,4.3, 18 km  from city center ," One of the most crowded and electrifying places to visit in Mumbai is the Colaba Causeway, famous for being a shopping paradise and having endless shops to choose from. It has a charm about it, which will suck you into its world of colourful shops and old-world cafes like a magnet. "
Mumbai, 5. Stroll around Gateway of India ,4.4, 18 km  from city center ," One of the most distinguished monument in Mumbai, The Gateway of India was built in 1924. Now it has become a popular tourist hub in the city. Located at Apollo Bunder Waterfront, the monument overlooks the Arabian Sea in the most beautiful way.  "
Mumbai, 6. Bollywood Tour at Film City ,3.8, 10 km  from city center , Indian Film Industry accounts as one of the largest in the world and Film City serves as an essential part of it. It is a place where it is difficult to differentiate between the reality and fakeness.  
Mumbai, 7. Enjoy Street Food ,, 7 out of 105  places to visit in Mumbai ," The food culture of Mumbai is defined by its street food. People from all economic classes eat from the roadside food stalls in Mumbai, which serve some of the best local food, even better than many restaurants. Mumbai's most famous street food includes Vada Pav, bhelpuri, panipuri, sevpuri, Bombay sandwich, ragda-pattice, pav bhaji, omlette pav and kebabs. Among the popular desserts of Mumbai are Kulfi and Ice Gola.  "
Mumbai, 8. Hanging Gardens ,3.8, 15 km  from city center ," Marked by bushes trimmed into shapes of various animals and proximity to the Arabian Sea are the Hanging Gardens, opposite the Kamla Nehru park. Spend a relaxed evening here, enjoying the sunset, especially if you are with kids. "
Mumbai, 9. Prince of Wales Museum ,4.3, 17 km  from city center ," The Prince of Wales Museum is regarded as one of the heritage buildings of Mumbai owing to its splendid architecture. The museum comprises of a plethora of ancient, exquisite artefacts relating to the rich and diverse history of India. "
Mumbai, 10. Mumbai Zoo ,3.8, 12 km  from city center ," Popularly known as Veermata Jijabai Udhyan, the zoo is the best way to spend family holidays amidst a vast variety of birds & animals. "
Mumbai, 11. Enjoy Rides at Essel World ,3.6, 19 km  from city center ," Located on the edge of northern suburbs, Mumbai's favourite adventure and water park, Essel World and Water Kingdom are probably the best themed park and water park in India. During the hot and humid summer or Mumbai, a lot of locals and tourists throng Water Kingdom. "
Mumbai, 12. National Museum of Indian Cinema ,, 14 km  from city center ," The National Museum of Indian Cinema is the first museum in the country that displays the history of Indian cinema. It is housed in two buildings, New Museum Building and the heritage Gulshan Mahal on Peddar Road in Mumbai. The museum showcases history of Indian Cinema through recordings, memorabilia, cameras, equipment and much more. "
Mumbai, 13. Wildlife Safari at Sanjay Gandhi National park ,3.8, 15 km  from city center ," This is a wildlife sanctuary and a habitat to abundance of flora and fauna, in the midst of a busy Mumbai. Famed to be one the most liked national parks, one can also enjoy a train ride through this one.



One can spot here Leopards, Macaques, Boars, Lions, Flying fox, Kingfisher, Sunbird and many more. A must visit attraction of the city, the park is also known for a huge population and variety of butterflies. "
Mumbai, 14. Pray at Siddhivinayak Temple ,4.3, 8 km  from city center ," Located in Prabhadevi, Siddhivinayak is a Lord Ganesha temple, one of the most significant and frequented temples in Mumbai. Visitors visit this temple in large numbers on daily basis. It is one of the richest temples in Mumbai. The wooden doors to the sanctum are carved with images of the Lord. The inner roof which is plated with gold has the central sculpture of Ganesha. "
Mumbai, 15. National gallery of Modern Art ,3.8, 17 km  from city center ," Situated in Colaba, Southern Mumbai, the National Gallery of Modern Art was established in 1996, with an objective to promote modern trends in the Indian culture. Initially a concert venue, the structure was later converted into an art gallery in 1954. The gallery boasts of its display of artworks from Indian as well as international artists ranging from M.F. Hussain, F.N. Souza, Amrita Shergil, Gaganendranath Tagore to Picasso. "
Mumbai, 16. Sunset at Haji Ali Dargah ,4.3, 13 km  from city center ," Situated at the backdrop of a beautiful view of the sea is the shrine of Haji Ali, a wealthy merchant turned into Muslim Sufi. People from all walks of life and religions come here to seek blessings. "
Mumbai, 17. Shopping at Fashion Street ,3.8, 16 km  from city center ," One of the favourite shopping hubs for the people of Mumbai especially the students, the place offers some of the trendiest and latest fashion clothes.  "
Mumbai, 18. Drive Through Bandra Worli Sea Link ,4.4, 9 km  from city center ," Spanning across the arc of Mumbai coastline, this is an eight-lane cable-stayed bridge in Mumbai. Officially known as Rajiv Gandhi Sea Link, it is a civil engineering wonder that reflects the modern infrastructure of the city of Mumbai. "
Mumbai, 19. Marvel at the Victoria Terminus ,4.4, 15 km  from city center ," Also known as Chhatrapati Shivaji Maharaj Terminus, the Victoria Terminus is the main railway station serving Mumbai. Constructed in the Victorian-Gothic style of architecture, the railway station is a declared as a World Heritage Site by the UNESCO. The station is one of the most famous historic landmark symbolizing the pre-independence British Raj in India. "
Mumbai, 20. Kamla Nehru park ,3.8, 16 km  from city center ," Named after the first wife of the late Prime Minister of India, Sri Pandit Jawaharlal Nehru, it is family spot for outings. Enjoy the view of Marine drive and the Chowpatty beach from here. "
Mumbai, 21. KidZania Mumbai ,, 5 km  from city center ," Kidzania is an indoor theme cum educational park for kids located in Ghatkopar West in Mumbai. There are no video games or any new age games, instead the entire space is setup in form of a mock city with real life professions for children to take up. The mock city has battery operated cars and tiny shops and clinics etc. The objective of the park is to educate, inspire and teach kids about real life in a fun and games way.  "
Mumbai, 22. ISKCON Temple ,3.3, 7 km  from city center ," Iskcon temple is a spiritual getaway from all the hustle and bustle of the city. A temple clad in marble and glass, Iskcon has an impressive architecture and promises to give a peaceful and tranquil experience. The complex also has a research and education centre conducting daily seminars and preaching on Vedic writings and an impressive library inside the compound. "
Mumbai, 23. Gorakhgad Trek ,3.5, 70 km  from city center , Gorakhgad is a hill fort in Maharashtra. Gorakhgad and Machindragad are twin forts in the Thane district of Maharashtra. Gorakhgad is situated at an elevation higher than its twin fort. 
Mumbai, 24. Kanheri caves ,3.8, 15 km  from city center ," Located in the Sanjay Gandhi National Park, the Kanheri Caves in Mumbai is a group of alcoves and rock-cut monuments that illustrate the Buddhist influence on the Indian art and culture. The caves are famous for its 109 special entrances and ancient sculptures, carvings, paintings and inscriptions dating from the 1st century to the 10th century. "
Mumbai, 25. Street Food at Girgaum Chowpatty ,4.3, 15 km  from city center ," Girgaum Chowpatty is a small sandy beach and a good place to chill, at the north end of Marine Drive, a must-go place for tourists visiting Marine Drive for the first time. Conveniently located next to Charni Road railway station, it is very crowded during evening and weekends and hosts street food stalls serving local delicacies. There are cafes/dine-in options available across the road as well. "
Mumbai, 26. Water Sports in Mandwa Beach ,3.5, 30 km  from city center ," A beautiful, serene and pristine beach in Mandwa Village - an hour long ferry ride away from Mumbai - is not just about quite long walks along the coast but also offers the buzz of water sports. "
Mumbai, 27. Global Pagoda ,3.8, 19 km  from city center ," Located near Gorai, North-West of Mumbai, the Global Vipassana Pagoda serves as a monument to peace and harmony. It is built as a form of gratitude to a Vipassana teacher and accountant general of Independent Burma, Sayayi U Ba Khin. He was instrumental in bringing Vipassanaa back to its country of origin, i.e. India. "
Mumbai, 28. Mahakali caves ,3.7, 6 km  from city center ," Alternatively known as Kondivite Caves, the Mahakali Caves are a total of nineteen rock-cut monuments, built between the duration of the 1st and 6th century. The main cave consists of Buddha figures and stupas, while the there are several Buddha idols carved on the rocks too. "
Mumbai, 29. Shopping at Lokhandwala ,3.3, 9 km  from city center , Lokhandwala is another place to shop happily and heartily. Do not miss the lip-smacking food around these shopping streets. 
Mumbai," 30. Partying at Hill Road and Linkin Road, Bandra ",3.3, 5 km  from city center ," Acknowledged for its high fashionable taste, Mumbai provides many opportunities to shop around. Besides Colaba, Bandra is another place for Shopaholics. "
Mumbai, 31. Makarandgad Trek ,3.5, 13 km  from city center ," Makarandgad (or Madhumakarandgad) is a hill fort in the state of Maharashtra. Believed to be comprised of twin peaks, Madhu and Makarandgad, the fort has thus derived its name. "
Mumbai, 32. Mahalaxmi temple ,3.9, 5 km  from city center ," The Mahalaxmi Temple is dedicated to Goddess Mahalaxmi or the 'Goddess of Wealth'. Thronged with devotees and tourists in large number throughout the year, the temple is a must visit if you are visiting Mumbai.  "
Mumbai, 33. Siddhgad Bhimashankar Trek ,3.5, 69 km  from city center ," Located in the beautiful expanses of the Western Ghats, the Bhimashankar Trek takes you through the thickets of the Bhimashankar jungles right up to the temple. Bhimashankar is located in the village Bhorgiri in the ghat region of the Sahyadri range. "
Mumbai, 34. Jehangir art gallery ,3.8, 17 km  from city center ," The Jehangir Art Gallery, an art gallery in Mumbai, was founded by Sir Cowasji Jehangir at the request of K K Hebbar and Homi Bhabha. It was built in 1952. Managed by the Committee of Management, the entire cost of this mansion was donated by Cowasji Jehangir.This gallery is placed at Kala Ghoda, behind the Prince of Wales Museum, in South Mumbai near the Gateway of India, and has four exhibition halls. The gallery was designed by GM Bhuta for GM Bhuta and Associates. "
Mumbai, 35. Naneghat Trek ,3.5, 88 km  from city center ," Situated at a height of 2,600 feet, Naneghat is a mountain pass through the Sahyadri Mountain Range in Maharashtra that connects the Konkan sea coast with the old town of Junnar in the Deccan. Once an important corridor link through the Ghatghar forest between the coastal region and the important towns inland, Naneghat is now a loved and much-frequented route for the trekkers and explorers. Boasting the trademark beauty of lush greens amidst patches of dusty terrain, typical to this region, Naneghat is a treat to the eyes, to the soul and to the nature-loving, adventure-seeking mind. 
 "
Mumbai, 36. Hajimalang Trek ,3.5, 31 km  from city center ," Sri Malang gad is a fort near Kalyan in the Raigad district of Maharashtra. It is known popularly as Haji Malang, which is one of the most famous among the three sufi shrines located on the hill. The structure of the fort is three-storeyed, and each tier has a specific name. "
Mumbai, 37. Mahuli Trek ,3.5, 60 km  from city center ," Mahuli is a hill fort in Maharashtra. Located in the district of Thane, the peak of the fort rises to an elevation of 2700 feet from the ground. The summit is actually a collection of 2-3 hills, all having typical names. "
Mumbai, 38. Jivdhan Trek ,3.5, 88 km  from city center ," Jivdhan is a hill fort in the state of Maharashtra. It is a part of the 'famous five' fort in the Sahyadri mountain range. The other forts which are a part of the famous five include Naneghat, Shivneri, Chavand and Hadsar. "
Mumbai, 39. Jama Masjid ,3.5, 17 km  from city center ," The Jama Masjid, popularly known as Friday Mosque, is the oldest mosque that Mumbai houses. A popular place of pilgrimage, it boasts of beautiful and intricate carvings, breathtaking artworks and the fascinating 'sangemarmar' stonework and has an interesting history attached to it.  "
Mumbai, 40. Mahipatagad Trek ,3.5, 152 km  from city center ," Mahipatagad is a hill fort in the state of Maharashtra. Mahipatagad is a twin fort of Rasalgad, located in the Ratnagiri district. It is famous for its six entrance door or 'Darwazas' but most of them have crumbled down. There is Shiva temple at the top. "
Mumbai, 41. Mount Mary Church ,3.0, 7 km  from city center ," The Basilica of Our Lady of the Mount is commonly called as the Mount Mary Church by the locals. Thousands of people of all faiths visit this church to attain peace and tranquillity in the caress of Mount Mary. The basilica is a truly grand, yet humble edifice made from nothing but stone.
 "
Mumbai, 42. Gorai Beach ,3.0, 21 km  from city center ," Located in the north suburb of Mumbai, 40 kms from the main city, Gorai Beach is one the cleanest, most tranquil and one of the most frequented beaches of Mumbai. Located near Bhayandar, on the Gorai Creek, the soothing calmness of this beach bordering the Arabian Sea, makes for a perfect leisure weekend vacation.  "
Mumbai, 43. Madh Island ,3.0, 12 km  from city center ," Home to umpteen villages, farmlands and surreal vistas, is the locale of Madh Island in Mumbai. Clustered with quaint fisher villages and dotted with lush green farms, Madh Island is a respite from the glitterati and dazzling environs of the city and can be reached by an hour’s drive from the main city.  "
Mumbai, 44. Marve Beach ,3.0, 16 km  from city center ," Away from the industrial pollution and the chaotic city life, Marve Beach is situated in Malad, in the western suburbs of Mumbai. Due to the strong tides and currents, it is generally not recommended to swim in the sea waters or even to step aside post evening hours.  "
Mumbai, 45. Versova Beach ,3.0, 8 km  from city center ," A continuation of Juhu Beach towards the Andheri suburbs, Versova Beach is comparatively less crowded and only separated by a creek from the former beach. Versova is essentially a fishing village inhabited by Kolis (fisherfolks) situated in the vicinity of the beach, and is a hotbed for fish trade.  "
Mumbai, 46. Dadar Chowpatty Beach ,3.0, 7 km  from city center ," As the name suggests, Dadar Chowpatty Beach is situated in the Dadar suburbs of Mumbai. Majorly popular for the giant view of the Bandra Worli Sea Link bridge, this beach is customarily used for jogging and watching beautiful sunsets. "
Mumbai, 47. Aksa Beach ,3.0, 14 km  from city center ," Located a little on the outskirts of the city in Malad, Aksa Beach is an unparalleled oasis for a rejuvenating retreat from the hustle bustle of the city traffic. The mesmerising coastline is one of the longest in the city and offers an extremely vivid and surreal panorama of the merging horizon ahead.  "
Mumbai, 48. Kalamb Beach ,3.0, 38 km  from city center ," Located in Nalasopara in Thane district of Maharashtra, is the really long and secluded Kalamb Beach. A paradise away from the din of the city, the beach is beautiful owing to its tranquility, serenity and an altogether mesmerising panorama. "
Mumbai, 49. Spend your evening at Worli Sea Face ,3.0, 10 km  from city center ," The exuberant promenade with lashing waves and gushing waters of the Arabian Sea, situated in Worli, Mumbai is popularly called Worli Sea Face. Home to the rich and affluent residential colonies, the posh locale is also a major business district.  "
Mumbai, 50. Uran ,3.0, 23 km  from city center ," Situated at the end of Navi Mumbai, Uran lies in the Konkan division between Panvel and Karjat. Primarily a tiny fishing and agriculture village, Uran has several beaches to its attribute- the most popular of which are Pirvad, Mankeshwar and ONGC. Surrounded by water bodies on three sides, the village is just attached to the land from the side of Raigarh district. Pirvad is the most frequented beach, with plenty of tourists visiting it every day, Mankeshwar is considered to be a religious beach owing to the grand temple of Lord Shiva situated at the seaside itself. Whereas ONGC is popular for housing the gas plant at the beach. "
Mumbai, 51. Hangout with friends at Bandstand ,3.0, 5 km  from city center ," Bandstand or Bandstand Promenade is the immaculate promenade in the queen suburbs of Bandra in Mumbai. Also known as Bandra Bandstand, it boasts of a joggers’ strip and a park in addition to being a happening hangout spot.  "
Mumbai, 52. Explore Cafes at Carter Road ,3.0, 6 km  from city center ," Situated next to Bandstand Promenade just next to Bandra, Carter Road is one of the most happening and popular hangout places among the Mumbaikars. The locale is a haven for foodies owing to its bazillion food options from the umpteen eateries situated on the sidewalk. "
